id,name,primary_wing_id,primary_hall_id,primary_room_id,tier,rationale,secondary_hall_ids,controversy_note,source_date_context
fanon,Frantz Fanon,wing-ethics-politics-society,colonialism-race-liberation,colonial-embodiment-liberation,anchor-exhibit,"Fanon is primary in colonial embodiment and liberation through psychiatry, Négritude, phenomenology, and the Algerian anticolonial struggle; later decolonial reception remains secondary.",critique-power-deconstruction;justice-democratic-reason;phenomenology-existence-embodiment,"Anticolonial/Fanonian primary; decolonial is used as a broad program label, not a claim of later coloniality-school membership.",1925 CE–1961 CE
iris-murdoch,Iris Murdoch,wing-ethics-politics-society,moral-life-practical-reason,moral-character-virtue,standard-individual-exhibit,"Iris Murdoch is primary in Character, flourishing, attention, and virtue revival because it preserves the record’s Moral philosopher formation in Ireland / Britain; no additional hall route is planned at current scope.",,,1919 CE–1999 CE
philippa-foot,Philippa Foot,wing-ethics-politics-society,moral-life-practical-reason,moral-character-virtue,standard-individual-exhibit,"Philippa Foot is primary in Character, flourishing, attention, and virtue revival because it preserves the record’s Moral philosopher formation in Britain; no additional hall route is planned at current scope.",,,1920 CE–2010 CE
judith-thomson,Judith Jarvis Thomson,wing-ethics-politics-society,moral-life-practical-reason,moral-rights-persons-futures,standard-individual-exhibit,"Judith Jarvis Thomson is primary in Rights, persons, hard cases, and future generations because it preserves the record’s Analytic ethics formation in United States; no additional hall route is planned at current scope.",,,1929 CE–2020 CE
thomas-nagel,Thomas Nagel,wing-core-questions,core-questions-forum,core-mind-self,anchor-exhibit,"Subjectivity and consciousness provide the clearest primary visitor narrative, with ethics and political equality as secondary routes.",justice-democratic-reason;moral-life-practical-reason,,1937 CE–present
derek-parfit,Derek Parfit,wing-ethics-politics-society,moral-life-practical-reason,moral-rights-persons-futures,anchor-exhibit,"Parfit uses personal identity to transform reasons, morality, and future generations, making Moral Life the primary home.",core-questions-forum,,1942 CE–2017 CE
martha-nussbaum,Martha Nussbaum,wing-ethics-politics-society,justice-democratic-reason,justice-capabilities-democracy,anchor-exhibit,"Martha Nussbaum is primary in Capabilities, dignity, democracy, and public reason because it preserves the record’s Moral / political formation in United States; later field influence is handled through secondary lenses.",feminist-philosophies;moral-life-practical-reason,,1947 CE–present
judith-butler,Judith Butler,wing-ethics-politics-society,feminist-philosophies,feminist-gender-norms,anchor-exhibit,"Butler is primary in gender, norms, performativity, and social ontology through feminist and queer theory, with poststructuralist and Continental reception treated as routes rather than formation labels.",critique-power-deconstruction,,1956 CE–present
angela-davis,Angela Davis,wing-ethics-politics-society,colonialism-race-liberation,colonial-black-feminism-abolition,anchor-exhibit,"Davis anchors a distinct bay through abolition, prisons, Black radical and Marxist feminism, and movements linking race, gender, and class.",feminist-philosophies;justice-democratic-reason,"Keep Davis’s abolitionist and Black radical traditions distinct from hooks’s pedagogy and cultural criticism; adjacency supports comparison, not collapse.",1944 CE–present
bell-hooks,bell hooks,wing-ethics-politics-society,colonialism-race-liberation,colonial-black-feminism-abolition,anchor-exhibit,"hooks anchors a distinct bay through engaged pedagogy, cultural criticism, love, and the everyday interlocking analysis of race, class, and gender.",feminist-philosophies;justice-democratic-reason,Keep hooks’s pedagogical and cultural project distinct from Davis’s prison abolition and Black radical traditions; use an explicit debate line between bays.,1952 CE–2021 CE
